{
  "version": "1.0",
  "articleSlug": "anthropic-ipo-ai-safety-2026",
  "campaign": "research_anthropic-ipo-ai-safety-2026",
  "state": "DRAFT",
  "sourceUrl": "https://aijoylab.kr/articles/anthropic-ipo-ai-safety-2026",
  "generatedAt": "2026-09-15T00:00:00.000Z",
  "updatedAt": "2026-09-15T00:00:00.000Z",
  "approval": { "approved": false, "approvedBy": null, "approvedAt": null },
  "channels": {
    "threads": {
      "status": "DRAFT",
      "variants": [
        {
          "id": "threads_hook_a",
          "title": "AI는 늦추자는데 IPO는 왜 서두를까",
          "body": "앤트로픽은 프론티어 AI의 능력 향상 속도를 늦춰야 한다고 말했습니다. 그런데 IPO 기대 기업가치는 약 2조 달러까지 거론됩니다. 겉으로는 모순처럼 보이지만, 더 중요한 질문은 따로 있습니다. 상장 이후 성장 압력이 커졌을 때도 안전 우선 원칙을 지킬 수 있느냐입니다.",
          "cta": "숫자와 인센티브를 분리해 전체 분석을 정리했습니다.",
          "hashtags": ["#Anthropic", "#AI", "#IPO", "#JoyLab"],
          "utmUrl": "https://aijoylab.kr/articles/anthropic-ipo-ai-safety-2026?utm_source=threads&utm_medium=social&utm_campaign=research_anthropic-ipo-ai-safety-2026&utm_content=threads_hook_a",
          "publishedUrl": null,
          "publishedAt": null
        },
        {
          "id": "threads_insight_b",
          "title": "2조 달러보다 더 중요한 숫자",
          "body": "앤트로픽의 IPO 논쟁에서 시선은 2조 달러 기업가치에 꽂힙니다. 하지만 투자자가 먼저 볼 것은 약 30.8배의 매출 멀티플과 그 매출의 질입니다. 추론 원가, 클라우드 파트너 비용, 엔터프라이즈 유지율이 함께 개선되지 않으면 높은 매출 성장만으로는 설명이 부족합니다.",
          "cta": "JoyLab은 성장률보다 인센티브와 현금흐름 구조를 함께 봅니다.",
          "hashtags": ["#AI투자", "#Anthropic", "#기업분석"],
          "utmUrl": "https://aijoylab.kr/articles/anthropic-ipo-ai-safety-2026?utm_source=threads&utm_medium=social&utm_campaign=research_anthropic-ipo-ai-safety-2026&utm_content=threads_insight_b",
          "publishedUrl": null,
          "publishedAt": null
        },
        {
          "id": "threads_question_c",
          "title": "안전과 성장은 함께 갈 수 있을까",
          "body": "AI 기업이 안전을 이유로 개발 속도 조절을 주장하면서 동시에 대규모 자본을 조달하는 것은 모순일까요? 저는 IPO 자체보다 상장 이후 어떤 지표를 우선하는지가 더 중요하다고 봅니다. 분기 성장률과 안전 검증이 충돌할 때 어떤 선택을 하는지가 진짜 테스트입니다.",
          "cta": "당신이라면 무엇을 먼저 확인하겠습니까?",
          "hashtags": ["#AI안전", "#거버넌스", "#Anthropic"],
          "utmUrl": "https://aijoylab.kr/articles/anthropic-ipo-ai-safety-2026?utm_source=threads&utm_medium=social&utm_campaign=research_anthropic-ipo-ai-safety-2026&utm_content=threads_question_c",
          "publishedUrl": null,
          "publishedAt": null
        }
      ]
    },
    "x": {
      "status": "DRAFT",
      "variants": [
        {
          "id": "x_data_a",
          "title": "Anthropic IPO 숫자",
          "body": "Anthropic IPO 핵심 숫자: 2026년 5월 기업가치 9,650억달러 → IPO 기대가치 약 2조달러 → 연환산 매출 650억달러 기준 약 30.8배 매출 멀티플. 논쟁의 핵심은 ‘안전 vs IPO’보다 이 멀티플을 지탱할 매출의 질입니다.",
          "cta": "전체 분석 ↓",
          "hashtags": ["#Anthropic", "#IPO", "#AI"],
          "utmUrl": "https://aijoylab.kr/articles/anthropic-ipo-ai-safety-2026?utm_source=x&utm_medium=social&utm_campaign=research_anthropic-ipo-ai-safety-2026&utm_content=x_data_a",
          "publishedUrl": null,
          "publishedAt": null
        },
        {
          "id": "x_debate_b",
          "title": "안전 주장과 IPO는 모순인가",
          "body": "‘AI는 늦추자면서 IPO는 간다’는 비판은 절반만 맞습니다. IPO 자체가 안전 주장을 거짓으로 만들지는 않습니다. 진짜 검증은 상장 후 성장률 압박과 안전 검증이 충돌할 때 시작됩니다.",
          "cta": "JoyLab 해석 ↓",
          "hashtags": ["#AI안전", "#Anthropic"],
          "utmUrl": "https://aijoylab.kr/articles/anthropic-ipo-ai-safety-2026?utm_source=x&utm_medium=social&utm_campaign=research_anthropic-ipo-ai-safety-2026&utm_content=x_debate_b",
          "publishedUrl": null,
          "publishedAt": null
        },
        {
          "id": "x_judgment_c",
          "title": "투자자가 볼 한 가지",
          "body": "Anthropic 이슈에서 투자자가 볼 것은 ‘AI 개발을 늦춘다’는 문구보다 실제 AI CAPEX와 추론 수요가 줄어드는지입니다. 말보다 자본 지출과 수요 지표가 먼저입니다.",
          "cta": "확인 지표 정리 ↓",
          "hashtags": ["#AI투자", "#CAPEX"],
          "utmUrl": "https://aijoylab.kr/articles/anthropic-ipo-ai-safety-2026?utm_source=x&utm_medium=social&utm_campaign=research_anthropic-ipo-ai-safety-2026&utm_content=x_judgment_c",
          "publishedUrl": null,
          "publishedAt": null
        }
      ]
    },
    "linkedin": {
      "status": "DRAFT",
      "variants": [
        {
          "id": "linkedin_analysis_a",
          "title": "Anthropic IPO가 보여주는 AI 거버넌스의 다음 문제",
          "body": "AI 기업의 안전 원칙은 비상장 상태와 상장 이후에 같은 방식으로 작동할까요? Anthropic은 프론티어 AI의 능력 향상 속도 조절을 주장하면서 IPO를 추진하고 있습니다. 이 장면을 단순한 모순으로 보기보다 거버넌스 문제로 볼 필요가 있습니다. 상장 이후에는 분기 성장률, 대규모 컴퓨팅 투자, 고객 확장 압력이 동시에 커집니다. 따라서 앞으로 확인할 것은 선언보다 의사결정 구조입니다. 독립 평가자가 실제 권한을 갖는지, 추론 비용과 매출총이익률이 개선되는지, 안전 검증 때문에 출시가 늦어질 때 경영진이 어떤 선택을 하는지가 핵심입니다.",
          "cta": "JoyLab에서 Fact → Interpretation → Scenario → Action 구조로 정리했습니다.",
          "hashtags": ["#AI", "#AIGovernance", "#Leadership", "#Anthropic"],
          "utmUrl": "https://aijoylab.kr/articles/anthropic-ipo-ai-safety-2026?utm_source=linkedin&utm_medium=social&utm_campaign=research_anthropic-ipo-ai-safety-2026&utm_content=linkedin_analysis_a",
          "publishedUrl": null,
          "publishedAt": null
        }
      ]
    },
    "naver": {
      "status": "DRAFT",
      "variants": [
        {
          "id": "naver_summary_a",
          "title": "앤트로픽 IPO, 왜 지금 서두르나｜2조 달러 기업가치와 AI 안전 논쟁",
          "body": "앤트로픽이 프론티어 AI 개발 속도 조절을 주장한 직후 대규모 IPO를 추진하면서 논쟁이 커지고 있습니다. 현재 시장에서 거론되는 기대 기업가치는 약 2조 달러입니다. 최근 연환산 매출 650억 달러를 기준으로 단순 계산하면 약 30.8배의 매출 멀티플입니다. 중요한 것은 ‘안전을 말하면서 상장한다’는 표면적 모순만이 아닙니다. 상장 이후 성장 압력이 커졌을 때 안전 검증, 컴퓨팅 비용, 엔터프라이즈 고객 유지율을 어떤 우선순위로 관리하는지가 실제 기업가치를 좌우합니다. JoyLab 원문에서는 Anthropic과 OpenAI의 IPO 선택 차이, 매출의 질, AI CAPEX와 추론 수요까지 함께 살펴봤습니다.",
          "cta": "전체 숫자와 투자 시나리오는 JoyLab 원문에서 확인할 수 있습니다.",
          "hashtags": ["#앤트로픽", "#AI", "#IPO", "#AI투자", "#JoyLab"],
          "utmUrl": "https://aijoylab.kr/articles/anthropic-ipo-ai-safety-2026?utm_source=naver&utm_medium=blog&utm_campaign=research_anthropic-ipo-ai-safety-2026&utm_content=naver_summary_a",
          "publishedUrl": null,
          "publishedAt": null
        }
      ]
    }
  },
  "publishLog": []
}
